{
  "event": "source_bundle_ready",
  "contract_version": "source-bundle-ready/v1",
  "correlation_id": "corr-source-bundle-0004",
  "idempotency_key": "idem-source-bundle-0004",
  "source_bundle_id": "source-bundle-0003",
  "external_model_version_id": "model-version-20260715-001",
  "tenant_id": "tenant-a",
  "project_id": "project-library",
  "manifest_ref": {
    "ref": "minio://edge-tpe-01/source-bundles/tenant-a/project-library/model-version-20260715-001/manifest.json?versionId=v-src-manifest-0001",
    "object_version_id": "v-src-manifest-0001",
    "etag": "etag-src-manifest-0001",
    "sha256": "dddddddddddddddddddddddddddddddddddddddddddddddddddddddddddddddd",
    "size_bytes": 2048
  },
  "manifest_sha256": "dddddddddddddddddddddddddddddddddddddddddddddddddddddddddddddddd",
  "claimed_at": "2026-07-16T07:58:20.000Z",
  "producer": {
    "producer_id": "ifc-worker-edge-01",
    "producer_kind": "external_ifc_worker",
    "agent_version": "2.4.1"
  },
  "project_display_name": "圖書館增建案",
  "model_category": "structure"
}
